{
  "protocolVersion": 1,
  "type": "command",
  "commandId": "cmd_mutate_wall_000001",
  "jobId": "job_fixture_002",
  "connectionId": "connection_fixture_001",
  "revitInstanceId": "instance_fixture_0001",
  "routeGeneration": 3,
  "leaseEpoch": 8,
  "documentFingerprint": "document_fixture_000001",
  "tool": "create_wall",
  "args": {
    "levelId": 101,
    "walls": []
  },
  "deadlineUnixMs": 1770000000000,
  "mutationClass": "mutation",
  "idempotencyKey": "idem_mutate_wall_000001"
}
